Режим,Российский пример,Международный пример,Китайский пример,Основной результат
Медиаизмерения,Mediascope,Nielsen,—,"Внимание, охват, контакт"
Национальное медиапокрытие,"Brand Analytics, SCAN","Factiva, LexisNexis",Юйцин-платформы,"Наблюдение за медиасистемой, выявление нарративов"
OSINT / data journalism,OSINT + BA/SCAN,GDELT + OSINT tools,Юйцин-анализ practices,"Реконструкция событий, превращение данных в истории"
Support / predictive analytics,"Талисман, risk-аналитика","Signal AI, Dataminr",Сина юйцин / Wisers,"Сценарии, предупреждение, рекомендация решения"
AI-native layer,Исследовательские LLM pipelines,"Dataminr, Signal AI",Midu / LLM reporting,Автоматизация извлечения сигнала
